{
  "slug": "memebitcoin",
  "schema_version": "1.0",
  "name": "MemeBitcoin",
  "aliases": [
    "MemeBitcoin lottery"
  ],
  "rank": 8,
  "status": "ไม่แนะนำทุกกรณี",
  "links": {
    "x": null,
    "site": null,
    "docs": null,
    "related": []
  },
  "chain": "ไม่ยืนยัน (ต้อง recheck)",
  "legal_entity": "ไม่ระบุ",
  "score": {
    "interest": 1.0,
    "trust": 0.5
  },
  "field2_interest": "1.0/10 — ไม่มีเหตุผลทางคณิตศาสตร์ให้เข้า ไม่ว่าราคาเข้าจะต่ำแค่ไหน",
  "trust_evidence": [
    "คณิตศาสตร์: โอกาสชนะต่อวัน ~3.7e-39 ที่ฐานผู้เล่น 60,000 => ตัวเลขที่โฆษณาเป็นไปไม่ได้",
    "ไม่พบ on-chain escrow/proof of funds ที่รองรับเงินรางวัล",
    "note: X handle ไม่ถูกบันทึก => ต้อง recheck"
  ],
  "model": "อ้าง lottery/accumulate pool; ไม่มีกลไกตรวจสอบได้; โครงสร้างรายได้อย่างเดียวคือคนซื้อ ticket ที่ไม่มีวันชนะ",
  "how_to_play": [
    "อย่าเข้า — ถ้าจะทดสอบให้ใช้ $0 (เข้าเฉพาะแบบฟรี/airdrop ถ้ามี)",
    "ตรวจใน 5 นาที: ถ้าไม่มี contract ที่ถือเงินรางวัลจริง + ไม่มี audit ของ randomness = จบ"
  ],
  "risks": [
    "ค่าคาดหวังติดลบโดยคณิตศาสตร์ (ไม่ใช่โดยความเสี่ยง)",
    "ไม่พิสูจน์เงินกอง",
    "ไม่ระบุ entity/KYC/audit",
    "รูปแบบตรงกับ scam/ponzi-adjacent lottery"
  ],
  "value_for_money": "ติดลบโดยคณิตศาสตร์ — ไม่มีความคุ้มค่ายในทุกระดับราคา",
  "house_edge": [
    {
      "component": "probability",
      "value": "~3.7e-39 ต่อวัน/คน — EV ต่อ ticket เป็นลบมหาศาล"
    },
    {
      "component": "no proof of funds",
      "value": "เงินรางวัลอาจไม่มีอยู่จริง"
    }
  ],
  "cost_of_entry_usd": 0,
  "opportunity": "ไม่มี — record นี้เก็บไว้เป็นตัวอย่าง 'รูปแบบที่ต้องปฏิเสธ' ไม่ใช่ทางเลือก",
  "returns": [
    {
      "budget_usd": 0,
      "note": "ทางเดียวที่มีเหตุผล",
      "expected_usd": 0
    },
    {
      "budget_usd": 100,
      "note": "เสียทั้งก้อน",
      "expected_usd": -100.0
    },
    {
      "budget_usd": 500,
      "note": "เสียทั้งก้อน",
      "expected_usd": -500.0
    },
    {
      "budget_usd": 1000,
      "note": "เสียทั้งก้อน",
      "expected_usd": -1000.0
    },
    {
      "budget_usd": 5000,
      "note": "เสียทั้งก้อน",
      "expected_usd": -5000.0
    },
    {
      "budget_usd": 10000,
      "note": "เสียทั้งก้อน",
      "expected_usd": -10000.0
    }
  ],
  "max_sane_budget_usd": 0,
  "capital_rule": "ห้ามเข้า (ห้ามแม้แต่ $100)",
  "history": [
    "ตรวจพบ (รอบก่อน): arithmetic dead, no proof of funds; รายละเอียด contract/handle ไม่ถูกบันทึก"
  ],
  "technical": {
    "onchain": [
      {
        "item": "escrow",
        "finding": "ไม่พบ contract ที่ถือเงินรางวัล"
      }
    ],
    "api_endpoints": [
      "n/a — ต้องระบุ chain ใหม่หากจะ re-audit"
    ],
    "accounts": {
      "main": {
        "handle": null
      }
    },
    "market": {
      "token": "n/a"
    }
  },
  "verdict_short": "Lottery/Math-based scheme ที่ probability ชัยชนะจริงต่ำจนกลายเป็นศูนย์: ที่ผู้เล่น 60,000 คน โอกาสชนะต่อวัน ~3.7e-39 และไม่มีหลักฐานเงินกอง (proof of funds) — 'dead on arithmetic' ไม่ใช่แค่ 'เสี่ยง'",
  "unverified": [
    "contract/chain",
    "X handle",
    "entity",
    "ว่ายังเปิดดำเนินการอยู่หรือไม่"
  ],
  "watch": [
    "ไม่ต้องเฝ้า — ถ้าเปลี่ยนเป็นมี proof of funds + randomness on-chain ค่อย re-audit (แต่ยังไงก็ยัง EV ลบ)"
  ],
  "needs_recheck": true,
  "stale_risk": "low",
  "stale_risk_note": "ข้อสรุปเป็นเชิงคณิตศาสตร์ ไม่ขึ้นกับราคา",
  "verified_on": "2026-09 (รอบแรก)",
  "sources": [
    "บันทึกวิเคราะห์รอบแรก (ไม่ได้ persist raw artifacts)"
  ],
  "generated_from": "generated by tools/build.py — source of truth is tools/data_*.py, edit there then rebuild"
}
