{
  "slug": "hypest",
  "schema_version": "1.0",
  "name": "HYPEST",
  "aliases": [
    "HYPEST leaderboard",
    "$HYPE (ชุมชน Hyperliquid)"
  ],
  "rank": 6,
  "status": "leaderboard เปิด; prize pool ยังไม่ active",
  "links": {
    "x": null,
    "site": null,
    "docs": null,
    "related": []
  },
  "chain": "HyperEVM / Hyperliquid ecosystem (จุดที่ต้องยืนยันซ้ำ) — ไม่ผูกกับ Hyperliquid DEX อย่างเป็นทางการ",
  "legal_entity": "ไม่ระบุ",
  "score": {
    "interest": 3.5,
    "trust": 3.0
  },
  "field2_interest": "3.5/10 — ถ้า pool เปิดจริงและจ่ายตามสเปกจะน่าสนใจขึ้นมาก; ณ วันตรวจไม่มีหลักฐานบนเชนรองรับ",
  "trust_evidence": [
    "on-chain/DB: 400 score cards เป็น non-transferable => ซื้ออันดับต่อไม่ได้ (ดีต่อ fairness)",
    "pool: 690M $HYPE เคลมไว้แต่ยังไม่ live (ไม่มี contract escrow ที่ตรวจเจอ)",
    "note: X handle ทางการไม่เคยถูกบันทึกในบันทึกเดิม => ต้องยืนยันก่อน"
  ],
  "model": "Points/leaderboard dApp: ทำกิจกรรม -> ได้ score card -> จัดอันดับ -> (ตามสเปก) แบ่ง pool; ไม่มี token ของตัวเองที่ตรวจสอบได้",
  "how_to_play": [
    "ตรวจ: ถามหา contract address ของ escrow แล้วเช็ค token balance จริง; ถ้าไม่มี = ยังไม่ผูกเงิน",
    "เข้า: ทำกิจกรรมเก็บคะแนน (ต้นทุนเวลา ไม่ควรมีต้นทุนเงินจนกว่าจะพิสูจน์ pool)",
    "ออก: ไม่มีตลาดรอง (non-transferable) => รางวัลคือสิ่งเดียวที่ได้"
  ],
  "risks": [
    "prize pool ไม่มีหลักฐานบนเชน ณ วันตรวจ",
    "ชื่อพัวพันระบบนิเวศ $HYPE แต่ไม่มีความเกี่ยวข้องทางการ => เสี่ยงต่อความสับสนจากการแอบอ้างความเกี่ยวข้อง",
    "กติกาคะแนนเปลี่ยนย้อนหลังได้ถ้าไม่มี on-chain spec",
    "ไม่มีทีม/entity ระบุ"
  ],
  "value_for_money": "ยังไม่คุ้มจ่าย — prize pool ยังไม่ถูกผูกกับ on-chain escrow ที่ตรวจพบ",
  "house_edge": [
    {
      "component": "pool not live",
      "value": "สเปกประกาศได้แต่ไม่ต้องจ่ายจนกว่าจะ deploy"
    },
    {
      "component": "non-transferable",
      "value": "ลดโอกาสเก็งกำไรแต่เพิ่ม lock-in ให้ผู้ใช้"
    }
  ],
  "cost_of_entry_usd": 0,
  "opportunity": "ค่าคาดหวังขึ้นกับ 2 เงื่อนไข: (1) escrow 690M $HYPE deploy จริง (2) สูตรแบ่งรางวัลถาวร — ก่อนทั้งสองอย่างถือเป็น lottery ticket ที่จ่ายด้วยเวลา",
  "returns": [
    {
      "budget_usd": 0,
      "note": "เก็บแต้มฟรี ถ้า pool ไม่จริงก็เสียเวลา",
      "expected_usd": 0
    },
    {
      "budget_usd": 100,
      "note": "ห้ามจ่ายเพื่อซื้ออันดับ/boost — ไม่มี on-chain backing",
      "expected_usd": -100.0
    },
    {
      "budget_usd": 500,
      "note": "ไม่มีความเสี่ยงนี้",
      "expected_usd": 0
    },
    {
      "budget_usd": 1000,
      "note": "ไม่มีความเสี่ยงนี้",
      "expected_usd": 0
    },
    {
      "budget_usd": 5000,
      "note": "ไม่มีความเสี่ยงนี้",
      "expected_usd": 0
    },
    {
      "budget_usd": 10000,
      "note": "ไม่มีความเสี่ยงนี้",
      "expected_usd": 0
    }
  ],
  "max_sane_budget_usd": 0,
  "capital_rule": "ใช้แรง/เวลาเท่านั้น จนกว่าจะประกาศ contract address ของ escrow แล้วตรวจสอบว่าถือ 690M $HYPE จริง",
  "history": [
    "ตรวจพบ: 400 non-transferable score cards; pool 690M $HYPE not live; X handle ไม่ถูกบันทึก",
    "note: record นี้ incomplete — ใช้เป็น 'รายการที่ต้อง recheck' มากกว่าข้อสรุปถาวร"
  ],
  "technical": {
    "onchain": [
      {
        "item": "score cards",
        "finding": "400 ใบ non-transferable"
      },
      {
        "item": "prize escrow",
        "finding": "ยังไม่พบ contract ที่ถือ 690M $HYPE ณ วันตรวจ"
      }
    ],
    "api_endpoints": [
      "ต้องระบุ endpoint/chain ใหม่ก่อนใช้ record นี้"
    ],
    "accounts": {
      "main": {
        "handle": null,
        "note": "ไม่เคยบันทึก"
      }
    },
    "market": {
      "token": "ไม่มีโทเคนที่ตรวจสอบได้"
    }
  },
  "verdict_short": "ระบบ leaderboard 400 ใบแบบ non-transferable (ตรวจสอบได้) ที่โฆษณา pool $HYPE 690 ล้านเหรียญที่ยัง 'ไม่เปิดใช้งาน' — โครงสร้างคะแนนจริงแต่เงินยังไม่ผูกกับสัญญา => ตอนนี้คือ campaign marketing ไม่ใช่ financial product",
  "unverified": [
    "X handle ทางการ",
    "escrow/pool on-chain proof",
    "สูตรรางวัล",
    "ทีม/entity",
    "chain ที่ deploy จริง"
  ],
  "watch": [
    "การประกาศ + deploy escrow (เช็ก balanceOf ของ contract ที่ระบุ)",
    "on-chain rules สำหรับ leaderboard",
    " KYC ของผู้รับรางวัล"
  ],
  "needs_recheck": true,
  "stale_risk": "high",
  "stale_risk_note": "ข้อมูลไม่ครบโดยเจตนา; ต้อง re-derive ก่อนใช้ตัดสินใจ",
  "verified_on": "2026-09 (รอบแรก — ข้อมูลไม่ครบโดยเจตนา)",
  "sources": [
    "บันทึกวิเคราะห์รอบก่อน (ไม่ได้ persist raw artifacts)",
    "HyperEVM public RPC (ต้อง re-run)"
  ],
  "generated_from": "generated by tools/build.py — source of truth is tools/data_*.py, edit there then rebuild"
}
