{
  "slug": "agnt",
  "schema_version": "1.0",
  "name": "Agnt",
  "aliases": [
    "agnt.trade",
    "AGNT"
  ],
  "rank": 7,
  "status": "mint 2,530/10,000; claimsOpen=false",
  "links": {
    "x": null,
    "site": "https://agnt.trade (ต้องยืนยัน)",
    "docs": null,
    "related": []
  },
  "chain": "ต้องยืนยัน (ไม่พบ contract ที่ตรวจซ้ำได้ในรอบนี้)",
  "legal_entity": "ไม่ระบุ",
  "score": {
    "interest": 3.0,
    "trust": 2.5
  },
  "field2_interest": "3.0/10 — มีของบนเชนแต่สภาพคล่องและสิทธิ์ผู้ใช้น้อยมาก",
  "trust_evidence": [
    "on-chain/DB: minted 2,530 จาก 10,000 (25.3%) => demand ต่ำกว่าที่โฆษณา",
    "concentration: 63% ของ supply ถือโดยกลุ่มบน (whales/team) => ราคาถูกกำหนดโดยคนไม่กี่กระเป๋า",
    "claimsOpen=false ณ วันตรวจ => ซื้อ/จองแล้วเอาของออกไม่ได้ทันที (ความเสี่ยง custody ชั่วคราว)",
    "note: X handle ทางการไม่ถูกบันทึกในบันทึกเดิม => ต้อง recheck"
  ],
  "model": "(ตามบันทึกเดิม) mint/allocation + claim queue; รายละเอียด utility/team ไม่ได้รับการยืนยัน",
  "how_to_play": [
    "ตรวจ: totalMinted/holderTop/claim flag ผ่าน RPC หรือ explorer ที่รองรับ chain ของเขา",
    "ถ้าจะเล่น: รอ claimsOpen=true ก่อนแล้วจึงเข้า — state 'จองแล้วรอ' คือความเสี่ยงเพิ่มโดยไม่ได้อะไร",
    "ออก: ตลาดรองเล็กมาก (mint 25%) => ราคาอ้างอิงน้อย"
  ],
  "risks": [
    "mint ค้าง 25.3% => supply คงเหลือกดราคาได้เรื่อย ๆ",
    "63% concentration",
    "claimsOpen=false (liquidity trap)",
    "ไม่พบเอกสาร team/entity/audit",
    "ข้อมูลกระจัดกระจาย — record นี้ incomplete"
  ],
  "value_for_money": "ไม่คุ้มที่ state ปัจจุบัน (mint 25.3%, concentration 63%, claimsOpen=false)",
  "house_edge": [
    {
      "component": "mint uptake",
      "value": "2,530/10,000 — ทีมเก็บส่วนต่างจากรอบถัดไป/ขายเองได้ เพราะ supply ยังเหลือ 75%"
    },
    {
      "component": "claim closed",
      "value": "เงินค้างในระบบโดยถอนไม่ได้ ณ วันตรวจ"
    }
  ],
  "cost_of_entry_usd": 0,
  "opportunity": "ถ้าอนาคต supply ถูกดูดจริง + claim เปิด + concentration คลาย down เป็น 20% => อาจกลายเป็น case 'ของถูกในตลาดเล็ก' แต่ตอนนี้ไม่ใช่",
  "returns": [
    {
      "budget_usd": 0,
      "note": "ตรวจ supply/claim status ฟรี",
      "expected_usd": 0
    },
    {
      "budget_usd": 100,
      "note": "ไม่แนะนำที่ state ปัจจุบัน",
      "expected_usd": -40.0
    },
    {
      "budget_usd": 500,
      "note": "ไม่แนะนำ",
      "expected_usd": -200.0
    },
    {
      "budget_usd": 1000,
      "note": "ไม่แนะนำ",
      "expected_usd": -400.0
    },
    {
      "budget_usd": 5000,
      "note": "ไม่แนะนำ",
      "expected_usd": -2000.0
    },
    {
      "budget_usd": 10000,
      "note": "ไม่แนะนำ",
      "expected_usd": -4000.0
    }
  ],
  "max_sane_budget_usd": 0,
  "capital_rule": "รอ claimsOpen=true และ top-10 < 40% ก่อนแล้วค่อยพิจารณา; ตอนนี้ $0",
  "history": [
    "ตรวจพบ (รอบก่อน): minted 2,530/10,000, concentration 63%, claimsOpen=false",
    "ข้อจำกัด: chain/contract ถาวรไม่ได้ถูกบันทึกรายละเอียด => recheck"
  ],
  "technical": {
    "onchain": [
      {
        "item": "minted",
        "finding": "2,530 / 10,000 (25.3%)"
      },
      {
        "item": "concentration",
        "finding": "63% ถือโดยกลุ่มบน"
      },
      {
        "item": "claimsOpen",
        "finding": "false ณ วันตรวจ"
      }
    ],
    "api_endpoints": [
      "ต้องระบุ chain/contract ใหม่ — ไม่อยู่ในบันทึกเดิม"
    ],
    "accounts": {
      "main": {
        "handle": null,
        "note": "ไม่เคยบันทึก"
      }
    },
    "market": {
      "token": "ไม่ยืนยัน"
    }
  },
  "verdict_short": "Mint ที่วิ่งไปเพียง 25.3% ของ supply (2,530/10,000) และความเข้มข้นการถือ 63% ในกลุ่มบน + ปุ่ม claim ยังปิด (claimsOpen=false) => โครงสร้างแบบ 'ของน้อย-คนน้อย-ถอนไม่ได้' ไม่มีอะไรให้สนับสนุนด้วยเงินตอนนี้",
  "unverified": [
    "chain/contract address",
    "X handle",
    "ทีม/entity",
    "สูตร allocation หลัง mint",
    "ว่า claims จะเปิดเมื่อไหร่"
  ],
  "watch": [
    "claimsOpen เปลี่ยนเป็น true",
    "อัตราการ mint",
    "top-10 ลดเหลือ <40%",
    "การเปิดเผย audit/contract verified"
  ],
  "needs_recheck": true,
  "stale_risk": "high",
  "stale_risk_note": "ข้อมูลไม่ครบโดยเจตนา",
  "verified_on": "2026-09 (รอบแรก — ข้อมูลไม่ครบโดยเจตนา)",
  "sources": [
    "บันทึกวิเคราะห์รอบแรก (ไม่ได้ persist raw artifacts)",
    "note: ต้อง re-derive ก่อนอ้างตัวเลข"
  ],
  "generated_from": "generated by tools/build.py — source of truth is tools/data_*.py, edit there then rebuild"
}
